{"complete":true,"counts":{"baseline":3,"baseline_only":1,"candidate":3,"candidate_only":1,"common_keys":2,"matched_exact":1,"matched_with_required_difference":1,"matched_within_tolerance":0},"derived_recipe_bytes":613,"discrepancy_count":3,"field_counts":{"amount":{"different":1,"exact":1,"within_tolerance":0}},"inputs":{"baseline":{"bytes":56,"sha256":"764689a6b509e50167c65f727c4dbd428c1552f0280b67055a3707aa2a3babbc"},"candidate":{"bytes":55,"sha256":"0c7968d45376dc246b177430daa30559735319af62c4527071c54b9cddd627bf"}},"normalization_runtime":{"implementation":"CPython","python_version":"3.14.7","unicode_version":"16.0.0"},"outcome":"FAIL","partition_receipt_version":2,"partitions":[{"baseline":{"bytes":32,"rows":1,"sha256":"84692c96f86a6e40c1e6d8440bbcd68251784bed3e034d838cc489f0f04b030c"},"bucket":0,"candidate":{"bytes":18,"rows":0,"sha256":"3de46b762f77c6e8534130de61e84c973215704f4bd92e37e95561a2dc0415f7"},"complete":true,"counts":{"baseline":1,"baseline_only":1,"candidate":0,"candidate_only":0,"common_keys":0,"matched_exact":0,"matched_with_required_difference":0,"matched_within_tolerance":0},"field_counts":{"amount":{"different":0,"exact":0,"within_tolerance":0}},"outcome":"FAIL"},{"baseline":{"bytes":30,"rows":1,"sha256":"9406502a3974f219b4ab6910fcecc77921a96df4c73f2c2d206e8aff18e21941"},"bucket":1,"candidate":{"bytes":30,"rows":1,"sha256":"4ca84ec06e1b618b680a3bdf8e916326edab1414e04ab00b41c4153b44be24db"},"complete":true,"counts":{"baseline":1,"baseline_only":0,"candidate":1,"candidate_only":0,"common_keys":1,"matched_exact":0,"matched_with_required_difference":1,"matched_within_tolerance":0},"field_counts":{"amount":{"different":1,"exact":0,"within_tolerance":0}},"outcome":"FAIL"},{"baseline":{"bytes":30,"rows":1,"sha256":"07b5c37f415a79f79f821925ed6da5141d8c85da1f4bc93839851bd44792a365"},"bucket":2,"candidate":{"bytes":43,"rows":2,"sha256":"503aa756bd30ace441f272f279ecb1400d31bcd3cf76c17bed851339e2a98c20"},"complete":true,"counts":{"baseline":1,"baseline_only":0,"candidate":2,"candidate_only":1,"common_keys":1,"matched_exact":1,"matched_with_required_difference":0,"matched_within_tolerance":0},"field_counts":{"amount":{"different":0,"exact":1,"within_tolerance":0}},"outcome":"FAIL"}],"plan_sha256":"ca786bbe7533cc1bf36a8cde0a8301b8633b0931509c71bd8419ff37f1a55ab0","policy_sha256":"3a8632f1ff9b3bbc6a595d026f75e72c37e53ab0cd32b0781407c05f3e75bd38","route_rows":{"baseline":3,"candidate":3},"routing":{"buckets":3,"encoding":"typed-key-v1","hash":"sha256","kind":"hash-v1"},"staged_bytes":907}
